{
  "stages": [
    {
      "id": "markdown_basic-lesson",
      "title": "Markdown Basics",
      "objective_ids": [
        "lo1",
        "lo2"
      ],
      "prerequisite_stage_ids": [],
      "study_depth": "standard",
      "est_minutes": 8,
      "status": "designed",
      "preview": "掌握当前范围的核心机制，并完成微测、练习和复习卡。"
    },
    {
      "id": "markdown_basic-review",
      "title": "间隔复习",
      "objective_ids": [
        "lo1",
        "lo2"
      ],
      "prerequisite_stage_ids": [
        "markdown_basic-lesson"
      ],
      "study_depth": "skim",
      "est_minutes": 5,
      "status": "planned",
      "preview": "在第 1、3、7 天主动回忆复习卡。"
    }
  ],
  "est_minutes_total": 13,
  "designed_scope": "Markdown Basics",
  "design_mode": "chapter_tutorial",
  "evidence_granularity": "code",
  "learner_profile_summary": "画像：`beginner / novice / practice / general / balanced`。",
  "personalization_decisions": [
    "检测到代码级来源 `build --fast`，加入最小命令实验；来源范围很短，仅设计 1 个 lesson。"
  ]
}
